{
  "id": "validation_pattern:tfim-small-system-gap-reproduction",
  "unit_type": "validation_pattern",
  "title": "TFIM small-system gap reproduction",
  "summary": "Validation pattern that checks the bounded exact gap before broader method claims.",
  "maturity": "human_promoted",
  "created_at": "2026-04-11T11:14:57+00:00",
  "updated_at": "2026-04-11T11:14:57+00:00",
  "topic_completion_status": "regression-stable",
  "tags": [
    "tfim",
    "validation",
    "gap"
  ],
  "assumptions": [
    "The tiny exact gap is a meaningful first benchmark in this lane."
  ],
  "regime": {
    "domain": "tfim benchmark-first seed",
    "approximations": [
      "tiny exact benchmark"
    ],
    "scale": "smoke-test",
    "boundary_conditions": [
      "bounded public route"
    ],
    "exclusions": [
      "large-scale numerics",
      "broad portability claims"
    ]
  },
  "scope": {
    "applies_to": [
      "bounded TFIM benchmark memory"
    ],
    "out_of_scope": [
      "full many-body closure"
    ]
  },
  "provenance": {
    "source_ids": [
      "source:tfim-exact-diagonalization-tool",
      "source:tfim-benchmark-code-method-acceptance",
      "source:aitp-test-runbook"
    ],
    "l1_artifacts": [
      "README.md#tfim-code-method-acceptance",
      "runtime/AITP_TEST_RUNBOOK.md#real-topic-acceptance-code-backed-benchmark-first-lane"
    ],
    "l3_runs": [
      "runtime/scripts/run_tfim_benchmark_code_method_acceptance.py"
    ],
    "l4_checks": [
      "runtime/scripts/run_tfim_benchmark_code_method_acceptance.py",
      "validation/tools/tfim_exact_diagonalization.py"
    ],
    "citations": [
      "AITP public TFIM benchmark-first acceptance lane"
    ]
  },
  "promotion": {
    "route": "L3->L4->L2",
    "review_mode": "human",
    "canonical_layer": "L2",
    "promoted_by": "aitp-cli",
    "promoted_at": "2026-04-11T11:14:57+00:00",
    "review_status": "accepted",
    "rationale": "Repo-seeded L2 MVP direction for the public TFIM benchmark-first lane."
  },
  "dependencies": [
    "method:tfim-exact-diagonalization-helper"
  ],
  "related_units": [
    "claim_card:tfim-benchmark-before-portability-claim"
  ],
  "payload": {
    "validation_axes": [
      "exact-gap reproduction",
      "artifact persistence"
    ]
  }
}
