{
  "id": "physical_picture:tfim-weak-coupling-benchmark-intuition",
  "unit_type": "physical_picture",
  "title": "TFIM weak-coupling benchmark intuition",
  "summary": "Weak-coupling physical picture for why the TFIM exact diagonalization benchmark workflow is a useful first bounded route.",
  "maturity": "human_promoted",
  "created_at": "2026-04-11T11:14:57+00:00",
  "updated_at": "2026-04-11T11:14:57+00:00",
  "topic_completion_status": "regression-stable",
  "tags": [
    "tfim",
    "physical-picture",
    "weak-coupling",
    "benchmark-first"
  ],
  "assumptions": [
    "The tiny exact benchmark is being used as route intuition rather than a full theory claim."
  ],
  "regime": {
    "domain": "tfim benchmark-first seed",
    "approximations": [
      "tiny exact benchmark"
    ],
    "scale": "smoke-test",
    "boundary_conditions": [
      "bounded public route"
    ],
    "exclusions": [
      "large-scale numerics",
      "broad portability claims"
    ]
  },
  "scope": {
    "applies_to": [
      "bounded TFIM benchmark memory"
    ],
    "out_of_scope": [
      "full many-body closure"
    ]
  },
  "provenance": {
    "source_ids": [
      "source:tfim-exact-diagonalization-tool",
      "source:tfim-benchmark-code-method-acceptance",
      "source:aitp-test-runbook"
    ],
    "l1_artifacts": [
      "README.md#tfim-code-method-acceptance",
      "runtime/AITP_TEST_RUNBOOK.md#real-topic-acceptance-code-backed-benchmark-first-lane"
    ],
    "l3_runs": [
      "runtime/scripts/run_tfim_benchmark_code_method_acceptance.py"
    ],
    "l4_checks": [
      "runtime/scripts/run_tfim_benchmark_code_method_acceptance.py",
      "validation/tools/tfim_exact_diagonalization.py"
    ],
    "citations": [
      "AITP public TFIM benchmark-first acceptance lane"
    ]
  },
  "promotion": {
    "route": "L3->L4->L2",
    "review_mode": "human",
    "canonical_layer": "L2",
    "promoted_by": "aitp-cli",
    "promoted_at": "2026-04-11T11:14:57+00:00",
    "review_status": "accepted",
    "rationale": "Repo-seeded L2 MVP direction for the public TFIM benchmark-first lane."
  },
  "dependencies": [
    "concept:tfim-transverse-field-ising-model",
    "method:tfim-exact-diagonalization-helper"
  ],
  "related_units": [
    "workflow:tfim-benchmark-workflow",
    "claim_card:tfim-benchmark-before-portability-claim",
    "warning_note:tfim-dense-ed-finite-size-limit"
  ],
  "payload": {
    "picture": "Use the small exact benchmark as a weak-coupling route intuition before making broader portability claims.",
    "intuition_scope": "bounded TFIM benchmark-first route",
    "supports_units": [
      "workflow:tfim-benchmark-workflow",
      "claim_card:tfim-benchmark-before-portability-claim"
    ],
    "known_limits": [
      "finite-size only",
      "not a proof of broader code portability"
    ]
  }
}
