{
  "id": "claim_card:tfim-benchmark-before-portability-claim",
  "unit_type": "claim_card",
  "title": "Benchmark before portability claim",
  "summary": "Promote the bounded exact benchmark memory before promoting broader code portability.",
  "maturity": "human_promoted",
  "created_at": "2026-04-11T11:14:57+00:00",
  "updated_at": "2026-04-11T11:14:57+00:00",
  "topic_completion_status": "regression-stable",
  "tags": [
    "tfim",
    "claim",
    "benchmark-first"
  ],
  "assumptions": [
    "The exact benchmark is the honest first closure target."
  ],
  "regime": {
    "domain": "tfim benchmark-first seed",
    "approximations": [
      "tiny exact benchmark"
    ],
    "scale": "smoke-test",
    "boundary_conditions": [
      "bounded public route"
    ],
    "exclusions": [
      "large-scale numerics",
      "broad portability claims"
    ]
  },
  "scope": {
    "applies_to": [
      "bounded TFIM benchmark memory"
    ],
    "out_of_scope": [
      "full many-body closure"
    ]
  },
  "provenance": {
    "source_ids": [
      "source:tfim-exact-diagonalization-tool",
      "source:tfim-benchmark-code-method-acceptance",
      "source:aitp-test-runbook"
    ],
    "l1_artifacts": [
      "README.md#tfim-code-method-acceptance",
      "runtime/AITP_TEST_RUNBOOK.md#real-topic-acceptance-code-backed-benchmark-first-lane"
    ],
    "l3_runs": [
      "runtime/scripts/run_tfim_benchmark_code_method_acceptance.py"
    ],
    "l4_checks": [
      "runtime/scripts/run_tfim_benchmark_code_method_acceptance.py",
      "validation/tools/tfim_exact_diagonalization.py"
    ],
    "citations": [
      "AITP public TFIM benchmark-first acceptance lane"
    ]
  },
  "promotion": {
    "route": "L3->L4->L2",
    "review_mode": "human",
    "canonical_layer": "L2",
    "promoted_by": "aitp-cli",
    "promoted_at": "2026-04-11T11:14:57+00:00",
    "review_status": "accepted",
    "rationale": "Repo-seeded L2 MVP direction for the public TFIM benchmark-first lane."
  },
  "dependencies": [
    "concept:tfim-benchmark-first-validation",
    "validation_pattern:tfim-small-system-gap-reproduction"
  ],
  "related_units": [
    "warning_note:tfim-dense-ed-finite-size-limit",
    "topic_skill_projection:tfim-benchmark-first-route"
  ],
  "payload": {
    "claim": "Benchmark-first promotion should precede portability claims."
  }
}
